{
  "$schema": "https://json-schema.org/draft/2020-12/schema",
  "$id": "https://example.local/phase-state.schema.json",
  "title": "Phase Gate State",
  "type": "object",
  "additionalProperties": false,
  "required": [
    "phase",
    "approved",
    "automation_mode",
    "auto_selected",
    "updated_at",
    "updated_by"
  ],
  "properties": {
    "phase": {
      "type": "string",
      "enum": [
        "discuss",
        "plan",
        "execute",
        "done"
      ],
      "description": "Current workflow phase."
    },
    "plan_id": {
      "type": [
        "string",
        "null"
      ],
      "pattern": "^[A-Za-z0-9][A-Za-z0-9._-]{2,79}$",
      "description": "Approved plan identifier. Required for execute and done."
    },
    "approved": {
      "type": "boolean",
      "description": "True only when the current plan is approved for the current phase."
    },
    "approved_by": {
      "type": [
        "string",
        "null"
      ],
      "minLength": 1,
      "description": "Human or system that approved the plan."
    },
    "approved_at": {
      "type": [
        "string",
        "null"
      ],
      "pattern": "^\\d{4}-\\d{2}-\\d{2}T\\d{2}:\\d{2}:\\d{2}(\\.\\d+)?Z$",
      "description": "Approval timestamp."
    },
    "summary": {
      "type": "string",
      "description": "Short description of the gated task."
    },
    "plan_path": {
      "type": [
        "string",
        "null"
      ],
      "description": "Path to the approved plan, PRD, ADR, or issue-plan."
    },
    "state_path": {
      "type": [
        "string",
        "null"
      ],
      "description": "Path to the durable human-readable project state file."
    },
    "checkpoint_path": {
      "type": [
        "string",
        "null"
      ],
      "description": "Path to the checkpoint document for the current phase."
    },
    "current_checkpoint": {
      "type": [
        "string",
        "null"
      ],
      "minLength": 1,
      "description": "Current checkpoint identifier or label."
    },
    "next_action": {
      "type": [
        "string",
        "null"
      ],
      "minLength": 1,
      "description": "One concrete next action for a fresh session."
    },
    "allowed_paths": {
      "type": "array",
      "items": {
        "type": "string",
        "minLength": 1
      },
      "minItems": 1,
      "uniqueItems": true,
      "description": "Paths or path prefixes allowed during execute."
    },
    "blocked_paths": {
      "type": "array",
      "items": {
        "type": "string",
        "minLength": 1
      },
      "uniqueItems": true,
      "description": "Paths or path prefixes that remain out of scope."
    },
    "acceptance_criteria": {
      "type": "array",
      "items": {
        "type": "string",
        "minLength": 1
      },
      "minItems": 1,
      "description": "Observable criteria for done."
    },
    "verification": {
      "type": "array",
      "items": {
        "type": "string",
        "minLength": 1
      },
      "minItems": 1,
      "description": "Commands or checks expected during execute."
    },
    "notes": {
      "type": "array",
      "items": {
        "type": "string",
        "minLength": 1
      }
    },
    "automation_mode": {
      "type": "string",
      "enum": [
        "manual",
        "auto",
        "chain"
      ],
      "description": "manual waits for explicit user choices; auto accepts recommended non-blocking choices; chain accepts recommended discuss->plan->execute progression until a stop condition appears."
    },
    "auto_selected": {
      "type": "array",
      "items": {
        "type": "object",
        "additionalProperties": false,
        "required": [
          "choice",
          "selected_value",
          "reason",
          "evidence_path",
          "risk_level",
          "reversible",
          "inside_allowed_paths",
          "stop_conditions_checked"
        ],
        "properties": {
          "choice": {
            "type": "string",
            "minLength": 1
          },
          "selected_value": {
            "type": "string",
            "minLength": 1
          },
          "reason": {
            "type": "string",
            "minLength": 1
          },
          "evidence_path": {
            "type": "string",
            "minLength": 1
          },
          "risk_level": {
            "type": "string",
            "enum": [
              "low",
              "medium",
              "high"
            ]
          },
          "reversible": {
            "type": "boolean"
          },
          "inside_allowed_paths": {
            "type": "boolean"
          },
          "stop_conditions_checked": {
            "type": "array",
            "items": {
              "type": "string",
              "minLength": 1
            },
            "minItems": 1
          }
        }
      },
      "description": "Recommended choices selected automatically under --auto or --chain."
    },
    "updated_at": {
      "type": "string",
      "pattern": "^\\d{4}-\\d{2}-\\d{2}T\\d{2}:\\d{2}:\\d{2}(\\.\\d+)?Z$"
    },
    "updated_by": {
      "type": "string",
      "minLength": 1
    }
  },
  "allOf": [
    {
      "if": {
        "properties": {
          "phase": {
            "const": "discuss"
          }
        },
        "required": [
          "phase"
        ]
      },
      "then": {
        "properties": {
          "approved": {
            "const": false
          },
          "plan_id": {
            "type": "null"
          }
        }
      }
    },
    {
      "if": {
        "properties": {
          "phase": {
            "const": "plan"
          }
        },
        "required": [
          "phase"
        ]
      },
      "then": {
        "required": [
          "plan_id",
          "summary",
          "plan_path",
          "state_path",
          "checkpoint_path",
          "current_checkpoint",
          "next_action",
          "acceptance_criteria",
          "verification"
        ],
        "properties": {
          "approved": {
            "const": false
          },
          "plan_id": {
            "type": "string"
          },
          "summary": {
            "type": "string",
            "minLength": 1
          },
          "plan_path": {
            "type": "string"
          },
          "state_path": {
            "type": "string"
          },
          "checkpoint_path": {
            "type": "string"
          },
          "current_checkpoint": {
            "type": "string"
          },
          "next_action": {
            "type": "string"
          }
        }
      }
    },
    {
      "if": {
        "properties": {
          "phase": {
            "const": "execute"
          }
        },
        "required": [
          "phase"
        ]
      },
      "then": {
        "required": [
          "plan_id",
          "approved_by",
          "approved_at",
          "plan_path",
          "state_path",
          "checkpoint_path",
          "current_checkpoint",
          "next_action",
          "allowed_paths",
          "acceptance_criteria",
          "verification"
        ],
        "properties": {
          "approved": {
            "const": true
          },
          "plan_id": {
            "type": "string"
          },
          "approved_by": {
            "type": "string"
          },
          "approved_at": {
            "type": "string",
            "pattern": "^\\d{4}-\\d{2}-\\d{2}T\\d{2}:\\d{2}:\\d{2}(\\.\\d+)?Z$"
          },
          "plan_path": {
            "type": "string"
          },
          "state_path": {
            "type": "string"
          },
          "checkpoint_path": {
            "type": "string"
          },
          "current_checkpoint": {
            "type": "string"
          },
          "next_action": {
            "type": "string"
          }
        }
      }
    },
    {
      "if": {
        "properties": {
          "phase": {
            "const": "done"
          }
        },
        "required": [
          "phase"
        ]
      },
      "then": {
        "required": [
          "plan_id",
          "approved_by",
          "approved_at",
          "summary",
          "plan_path",
          "state_path",
          "checkpoint_path",
          "current_checkpoint",
          "next_action",
          "acceptance_criteria",
          "verification"
        ],
        "properties": {
          "approved": {
            "const": true
          },
          "plan_id": {
            "type": "string"
          },
          "summary": {
            "type": "string",
            "minLength": 1
          },
          "plan_path": {
            "type": "string"
          },
          "state_path": {
            "type": "string"
          },
          "checkpoint_path": {
            "type": "string"
          },
          "current_checkpoint": {
            "type": "string"
          },
          "next_action": {
            "type": "string"
          }
        }
      }
    },
    {
      "if": {
        "properties": {
          "automation_mode": {
            "enum": [
              "auto",
              "chain"
            ]
          }
        },
        "required": [
          "automation_mode"
        ]
      },
      "then": {
        "properties": {
          "auto_selected": {
            "type": "array",
            "minItems": 1
          }
        }
      }
    }
  ]
}
